{"contract":{"name":"pccb","version":"v1"},"pccb_id":"pccb_diff_001","issued_at":"2026-01-01T12:00:00Z","not_before":"2026-01-01T12:00:00Z","expires_at":"2026-01-01T12:05:00Z","issuer":{"type":"service","id":"issuer_diff"},"subject":{"type":"agent","id":"agent_7"},"tenant":{"tenant_id":"tenant_acme"},"audience":{"type":"service","id":"payments-edge"},"action":{"name":"payment.refund","capability":"payments.refund","parameters":{"amount_minor":2500,"currency":"EUR","memo":"Rückerstattung für Bestellung #42 ✓"}},"target":{"resource_type":"charge","resource_id":"ch_3Nq"},"scope":{"mode":"exact","capabilities":["payments.refund"],"single_use":true,"resource_selectors":[{"resource_id":"ch_3Nq"}],"parameter_constraints":{"amount_minor":2500,"currency":"EUR","memo":"Rückerstattung für Bestellung #42 ✓"}},"nonce":"nonce-diff-0000000000000001","action_hash":{"algorithm":"sha-256","canonicalization":"ACTENON-JCS-STRICT-1","value":"dd0bc5ca0b064711c1c43476c0941ddae0678bde7ec0e4776f923d8957698b80"},"intent_id":"intent_diff_001","signature":{"algorithm":"HS256","key_id":"DIFF-HMAC-1","encoding":"base64url","value":"4iP5YmR_fZZMGViWMY3Pxg-hglCuKiiIikV_TD0462c"}}