{
  "contract": {
    "name": "pccb",
    "version": "v1"
  },
  "pccb_id": "pccb_portable_hello_world_action_mutation_001",
  "intent_id": "intent_portable_hello_world_001",
  "issued_at": "2026-01-01T12:00:00Z",
  "not_before": "2026-01-01T12:00:00Z",
  "expires_at": "2026-01-01T12:05:00Z",
  "issuer": {
    "type": "service",
    "id": "portable_local_issuer",
    "display_name": "Portable Local Issuer"
  },
  "subject": {
    "type": "service",
    "id": "portable_demo_actor",
    "display_name": "Portable Demo Actor"
  },
  "tenant": {
    "tenant_id": "tenant_portable_demo"
  },
  "audience": {
    "type": "service",
    "id": "portable-hello-world-endpoint"
  },
  "action": {
    "name": "hello_world.read",
    "capability": "protected_resource.read",
    "parameters": {
      "message": "portable hello world from attacker"
    }
  },
  "target": {
    "resource_type": "hello_resource",
    "resource_id": "hello_resource_demo_001"
  },
  "scope": {
    "mode": "exact",
    "capabilities": [
      "protected_resource.read"
    ],
    "resource_selectors": [
      {
        "resource_id": "hello_resource_demo_001"
      }
    ],
    "parameter_constraints": {
      "exact_message": "portable hello world from attacker"
    },
    "single_use": true
  },
  "nonce": "nonce-portable-hello-world-action-mutation-0001",
  "action_hash": {
    "algorithm": "sha-256",
    "canonicalization": "RFC8785-JCS",
    "value": "bec0274aad1f25bff4a035e82e852544bb2dc0890e76b2dcd0b8901e95d8b450"
  },
  "signature": {
    "algorithm": "HS256",
    "key_id": "local-proof-v1",
    "encoding": "base64url",
    "value": "AwWt6DoH4bC3JxXguNujWJ-MfvxbiQOHrLOrPY-MMeM"
  }
}
