{"contract":{"name":"pccb","version":"v1"},"pccb_id":"pccb_diff_001","issued_at":"2026-01-01T12:00:00Z","not_before":"2026-01-01T12:00:00Z","expires_at":"2026-01-01T12:05:00Z","issuer":{"type":"service","id":"issuer_diff"},"subject":{"type":"agent","id":"agent_7"},"tenant":{"tenant_id":"tenant_acme"},"audience":{"type":"service","id":"payments-edge"},"action":{"name":"payment.refund","capability":"payments.refund","parameters":{"amount_minor":2500,"currency":"EUR","memo":"Rückerstattung für Bestellung #42 ✓","deep":{"n":{"n":{"n":{"n":{"n":{"n":{"n":{"n":{"n":{"n":{"n":{"n":{"n":{"n":{"n":{"n":{"n":{"n":{"n":{"n":{"n":{"n":{"n":{"n":{"n":{"n":{"n":{"n":{"n":{"n":{"n":0}}}}}}}}}}}}}}}}}}}}}}}}}}}}}}}}},"target":{"resource_type":"charge","resource_id":"ch_3Nq"},"scope":{"mode":"exact","capabilities":["payments.refund"],"single_use":true,"resource_selectors":[{"resource_id":"ch_3Nq"}],"parameter_constraints":{"amount_minor":2500,"currency":"EUR","memo":"Rückerstattung für Bestellung #42 ✓","deep":{"n":{"n":{"n":{"n":{"n":{"n":{"n":{"n":{"n":{"n":{"n":{"n":{"n":{"n":{"n":{"n":{"n":{"n":{"n":{"n":{"n":{"n":{"n":{"n":{"n":{"n":{"n":{"n":{"n":{"n":{"n":0}}}}}}}}}}}}}}}}}}}}}}}}}}}}}}}}},"nonce":"nonce-diff-0000000000000001","action_hash":{"algorithm":"sha-256","canonicalization":"ACTENON-JCS-STRICT-1","value":"12a8feb0251c606f10f3a8689ba4d5fa21a6dfbaaedd3d5bc299a232fdc1a5c4"},"intent_id":"intent_diff_001","signature":{"algorithm":"HS256","key_id":"diff-hmac-1","encoding":"base64url","value":"CgFwRCmMH4fD3sTXA9gUaW0jv0iQpxh3xBPbGKQm_wY"}}